{
  "schema_version": 0,
  "id": "gateway-capability-019fbb00000070008000000000000012",
  "tenant_id": "demo-fleet",
  "timestamp": "2026-08-01T15:00:00.000Z",
  "kind": "gateway_capability_declaration",
  "gateway_version": 0,
  "session_id": "session-019fbb00000070008000000000000011",
  "capabilities": [
    "approval.forward",
    "workspace.write"
  ]
}
